{
  "version": "1.0",
  "artifact_type": "worker_self_check",
  "artifact_id": "wsc-task-003",
  "producer_type": "software_engineer",
  "task_id": "task-003",
  "known_risks": [
    "토큰 갱신 경로가 E2E로 검증되지 않음 — refresh token 만료 시 동작 불확실",
    "비밀번호 재설정 폼에서 백엔드 API 미완성으로 인한 에러 핸들링 미검증",
    "remember me 체크박스 추가 후 세션 스토리지 로직 변경이 기존 로그인 플로우에 영향 줄 가능성"
  ],
  "untested_paths": [
    "탭 복원 후 만료된 세션 처리 경로",
    "동시 다중 탭에서의 로그아웃 전파",
    "네트워크 오류 시 토큰 갱신 재시도 로직"
  ],
  "possible_stubs": [
    "비밀번호 재설정 이메일 전송 API — 현재 mock 응답 반환 중"
  ],
  "what_to_test_next": [
    "로그인 실패 후 재시도 — failed-login 렌더링 검증 (mem-001 참조)",
    "토큰 갱신 만료 후 재인증 유도 플로우",
    "remember me 활성화 상태에서 브라우저 재시작 후 세션 유지 확인"
  ],
  "confidence": 2,
  "summary": "핵심 happy path(로그인, 회원가입)는 정상 동작하나, 토큰 갱신 및 세션 복원 등 recovery 경로에 대한 신뢰도가 낮음. 비밀번호 재설정은 백엔드 stub 상태로 실 검증 불가.",
  "created_at": "2026-04-01T10:00:00Z",
  "memory_suggestions": [
    "cargo is installed at /usr/local/bin/cargo — not in default PATH on this system"
  ]
}